{
  "dataset": "ai_power_profiles_v2",
  "release_id": "ai-power-v2.0-pilot-staging",
  "release_status": "staging",
  "framework_version": "2.0",
  "methodology_version": "2.0-pilot",
  "schema_version": "2.0",
  "evidence_cutoff_at": null,
  "assessed_at": null,
  "published_at": null,
  "pipeline": {
    "pipeline_version": "ai-power-pipeline-v2.0.0",
    "scoring_mode": "evidence_packet_then_deterministic_summary",
    "model_extraction_version": null,
    "model_verification_version": null,
    "source_snapshot_hashes_required": true
  },
  "coverage": {
    "legacy_registry_entities": 84,
    "pilot_candidates": 20,
    "attempted": 0,
    "complete": 0,
    "partial": 0,
    "not_started": 20,
    "unassessed": 20,
    "disclosure_bias_warning": "Profile completeness measures assessable public evidence, not underlying company power."
  },
  "profiles": [
    { "entity": { "id": "company-nvidia", "name": "NVIDIA", "aliases": ["NVDA", "Nvidia Corporation"], "ticker": "NVDA", "type": "company", "coverage_group": "chips_manufacturing_memory", "parent_id": null }, "mechanism": { "id": "accelerator-platform", "title": "AI accelerator platform and software ecosystem", "primary_force": "compute", "secondary_forces": ["interface"], "relationship": "unknown", "stage": "unverified", "scope": "To be established from verified evidence.", "selection_basis": "Pilot research scope; not a power conclusion." }, "collection": { "attempted": false, "status": "not_started", "attempted_at": null, "source_documents": 0, "targeted_followups": 0, "reason": "Evidence collection has not run." }, "assessment": null, "evidence_refs": [] },
    { "entity": { "id": "company-amd", "name": "AMD", "aliases": ["Advanced Micro Devices"], "ticker": "AMD", "type": "company", "coverage_group": "chips_manufacturing_memory", "parent_id": null }, "mechanism": { "id": "accelerator-platform", "title": "AI accelerator platform and software ecosystem", "primary_force": "compute", "secondary_forces": [], "relationship": "unknown", "stage": "unverified", "scope": "To be established from verified evidence.", "selection_basis": "Pilot research scope; not a power conclusion." }, "collection": { "attempted": false, "status": "not_started", "attempted_at": null, "source_documents": 0, "targeted_followups": 0, "reason": "Evidence collection has not run." }, "assessment": null, "evidence_refs": [] },
    { "entity": { "id": "company-tsmc", "name": "TSMC", "aliases": ["TSM", "Taiwan Semiconductor", "Taiwan Semiconductor Manufacturing Company"], "ticker": "TSM", "type": "company", "coverage_group": "chips_manufacturing_memory", "parent_id": null }, "mechanism": { "id": "leading-edge-foundry", "title": "Leading-edge semiconductor foundry capability", "primary_force": "compute", "secondary_forces": ["energy"], "relationship": "unknown", "stage": "unverified", "scope": "To be established from verified evidence.", "selection_basis": "Pilot research scope; not a power conclusion." }, "collection": { "attempted": false, "status": "not_started", "attempted_at": null, "source_documents": 0, "targeted_followups": 0, "reason": "Evidence collection has not run." }, "assessment": null, "evidence_refs": [] },
    { "entity": { "id": "company-asml", "name": "ASML", "aliases": ["ASML Holding"], "ticker": "ASML", "type": "company", "coverage_group": "chips_manufacturing_memory", "parent_id": null }, "mechanism": { "id": "euv-lithography", "title": "Advanced lithography systems", "primary_force": "compute", "secondary_forces": [], "relationship": "unknown", "stage": "unverified", "scope": "To be established from verified evidence.", "selection_basis": "Pilot research scope; not a power conclusion." }, "collection": { "attempted": false, "status": "not_started", "attempted_at": null, "source_documents": 0, "targeted_followups": 0, "reason": "Evidence collection has not run." }, "assessment": null, "evidence_refs": [] },
    { "entity": { "id": "company-sk-hynix", "name": "SK Hynix", "aliases": ["SKHX", "SKHY", "000660.KS"], "ticker": "000660.KS", "type": "company", "coverage_group": "chips_manufacturing_memory", "parent_id": null }, "mechanism": { "id": "high-bandwidth-memory", "title": "High-bandwidth memory supply", "primary_force": "compute", "secondary_forces": [], "relationship": "unknown", "stage": "unverified", "scope": "To be established from verified evidence.", "selection_basis": "Pilot research scope; not a power conclusion." }, "collection": { "attempted": false, "status": "not_started", "attempted_at": null, "source_documents": 0, "targeted_followups": 0, "reason": "Evidence collection has not run." }, "assessment": null, "evidence_refs": [] },
    { "entity": { "id": "company-micron", "name": "Micron Technology", "aliases": ["MU", "Micron"], "ticker": "MU", "type": "company", "coverage_group": "chips_manufacturing_memory", "parent_id": null }, "mechanism": { "id": "high-bandwidth-memory", "title": "High-bandwidth memory supply", "primary_force": "compute", "secondary_forces": [], "relationship": "unknown", "stage": "unverified", "scope": "To be established from verified evidence.", "selection_basis": "Pilot research scope; not a power conclusion." }, "collection": { "attempted": false, "status": "not_started", "attempted_at": null, "source_documents": 0, "targeted_followups": 0, "reason": "Evidence collection has not run." }, "assessment": null, "evidence_refs": [] },
    { "entity": { "id": "company-microsoft", "name": "Microsoft", "aliases": ["MSFT"], "ticker": "MSFT", "type": "company", "coverage_group": "cloud_ecosystems", "parent_id": null }, "mechanism": { "id": "cloud-distribution-rights", "title": "Cloud capacity, model access, and enterprise distribution", "primary_force": "interface", "secondary_forces": ["compute", "alignment"], "relationship": "unknown", "stage": "unverified", "scope": "To be established from verified evidence.", "selection_basis": "Pilot research scope; not a power conclusion." }, "collection": { "attempted": false, "status": "not_started", "attempted_at": null, "source_documents": 0, "targeted_followups": 0, "reason": "Evidence collection has not run." }, "assessment": null, "evidence_refs": [] },
    { "entity": { "id": "company-amazon", "name": "Amazon", "aliases": ["AMZN", "Amazon.com", "AWS"], "ticker": "AMZN", "type": "company", "coverage_group": "cloud_ecosystems", "parent_id": null }, "mechanism": { "id": "cloud-model-marketplace", "title": "Cloud capacity and multi-model distribution", "primary_force": "compute", "secondary_forces": ["interface"], "relationship": "unknown", "stage": "unverified", "scope": "To be established from verified evidence.", "selection_basis": "Pilot research scope; not a power conclusion." }, "collection": { "attempted": false, "status": "not_started", "attempted_at": null, "source_documents": 0, "targeted_followups": 0, "reason": "Evidence collection has not run." }, "assessment": null, "evidence_refs": [] },
    { "entity": { "id": "company-alphabet", "name": "Alphabet", "aliases": ["Google", "GOOG", "GOOGL", "Alphabet Inc"], "ticker": "GOOGL", "type": "company", "coverage_group": "cloud_ecosystems", "parent_id": null }, "mechanism": { "id": "integrated-ai-ecosystem", "title": "Cloud, model, and consumer distribution ecosystem", "primary_force": "interface", "secondary_forces": ["compute", "alignment"], "relationship": "unknown", "stage": "unverified", "scope": "Consolidated Alphabet boundary; subsidiary evidence requires explicit attribution.", "selection_basis": "Pilot research scope; not a power conclusion." }, "collection": { "attempted": false, "status": "not_started", "attempted_at": null, "source_documents": 0, "targeted_followups": 0, "reason": "Evidence collection has not run." }, "assessment": null, "evidence_refs": [] },
    { "entity": { "id": "company-openai", "name": "OpenAI", "aliases": ["Open AI"], "ticker": null, "type": "company", "coverage_group": "model_developers", "parent_id": null }, "mechanism": { "id": "frontier-model-access", "title": "Frontier model access and product distribution", "primary_force": "compute", "secondary_forces": ["interface", "alignment"], "relationship": "unknown", "stage": "unverified", "scope": "To be established from verified evidence.", "selection_basis": "Pilot research scope; not a power conclusion." }, "collection": { "attempted": false, "status": "not_started", "attempted_at": null, "source_documents": 0, "targeted_followups": 0, "reason": "Evidence collection has not run." }, "assessment": null, "evidence_refs": [] },
    { "entity": { "id": "company-anthropic", "name": "Anthropic", "aliases": ["Anthropic PBC", "Claude"], "ticker": null, "type": "company", "coverage_group": "model_developers", "parent_id": null }, "mechanism": { "id": "frontier-model-access", "title": "Frontier model access and safety-governed deployment", "primary_force": "compute", "secondary_forces": ["alignment", "interface"], "relationship": "unknown", "stage": "unverified", "scope": "To be established from verified evidence.", "selection_basis": "Pilot research scope; not a power conclusion." }, "collection": { "attempted": false, "status": "not_started", "attempted_at": null, "source_documents": 0, "targeted_followups": 0, "reason": "Evidence collection has not run." }, "assessment": null, "evidence_refs": [] },